{
  "paper": {
    "title": "Phase-curve Evidence for an Atmosphere on TRAPPIST-1 b",
    "doi": "10.48550/arXiv.2409.13036",
    "publication_year": 2024,
    "domain": "exoplanet-atmospheres",
    "study_type": "observational-astronomy"
  },
  "core_question": "Does TRAPPIST-1 b possess a detectable atmosphere, and what are its properties?",
  "datasets_or_cohorts": [
    {
      "id": "observed-system",
      "label": "Observed System",
      "sample_size_or_observations": "1 planet",
      "description": "Phase-resolved thermal spectra of TRAPPIST-1 b obtained with JWST MIRI."
    },
    {
      "id": "null-scenario",
      "label": "Null Scenario",
      "sample_size_or_observations": "model",
      "description": "Bare-rock, no-atmosphere model with minimal heat redistribution used as baseline."
    },
    {
      "id": "co2-atmosphere",
      "label": "CO2-rich Atmosphere",
      "sample_size_or_observations": "model",
      "description": "Atmosphere model with significant CO2 absorption and moderate pressure."
    },
    {
      "id": "o2-atmosphere",
      "label": "O2-rich Atmosphere",
      "sample_size_or_observations": "model",
      "description": "Oxidized composition scenario with weaker CO2 signature constraints."
    }
  ],
  "major_limitations": [
    "Single‑planet study does not establish atmospheric prevalence across M‑dwarf rocky planets.",
    "Retrieval assumptions (circulation, opacity priors, cloud treatment) affect quantitative posteriors.",
    "Stellar variability and instrument systematics can bias weak spectral features."
  ]
}