{
  "paper": {
    "title": "Phase-curve Evidence for an Atmosphere on TRAPPIST-1 b",
    "doi": "10.48550/arXiv.2409.13036",
    "publication_year": 2024,
    "domain": "exoplanet-atmospheres",
    "study_type": "observational-astronomy"
  },
  "core_question": "The key question is whether TRAPPIST-1 b retains any atmosphere under strong stellar irradiation.",
  "datasets_or_cohorts": [
    {
      "id": "trappist-1b-obs",
      "label": "TRAPPIST-1 b Observations",
      "sample_size_or_observations": "one rocky exoplanet (TRAPPIST-1 b)",
      "description": "JWST MIRI low-resolution spectroscopy over an orbital phase curve measuring thermal variation."
    },
    {
      "id": "null-scenario",
      "label": "Null Scenario",
      "sample_size_or_observations": "Simulation",
      "description": "Bare-rock, no-atmosphere model with minimal heat redistribution used as a null baseline."
    },
    {
      "id": "co2-rich",
      "label": "CO2-rich atmosphere",
      "sample_size_or_observations": "Simulation",
      "description": "Atmosphere model with significant greenhouse gas absorption used for comparison."
    },
    {
      "id": "o2-rich",
      "label": "O2-rich atmosphere",
      "sample_size_or_observations": "Simulation",
      "description": "Oxidized composition with weaker CO2 signature constraints used in model comparisons."
    }
  ],
  "major_limitations": [
    "This is a single-planet study and does not establish atmospheric prevalence across all M-dwarf rocky planets.",
    "Retrieval assumptions (circulation, opacity priors, cloud treatment) affect quantitative posteriors.",
    "Stellar variability and instrument systematics can bias weak spectral features.",
    "Night-side constraints are weaker than day-side constraints in the current dataset."
  ]
}
