{
  "paper": {
    "title": "Phase-curve Evidence for an Atmosphere on TRAPPIST-1 b",
    "doi": "10.48550/arXiv.2409.13036",
    "publication_year": 2024,
    "domain": "exoplanet-atmospheres",
    "study_type": "observational-astronomy"
  },
  "core_question": "Does the Earth-sized exoplanet TRAPPIST-1 b retain an atmosphere, as inferred from JWST/MIRI thermal phase-curve spectroscopy and spectral structure near the 15 um CO2 band?",
  "datasets_or_cohorts": [
    {
      "id": "trappist-1b-phase-curve",
      "label": "TRAPPIST-1 b JWST/MIRI phase-curve dataset",
      "sample_size_or_observations": "One orbital phase curve with phase-resolved thermal spectra",
      "description": "Phase-resolved thermal spectra of TRAPPIST-1 b observed with JWST MIRI low-resolution spectroscopy, capturing thermal phase variation and spectral structure around the 15 um CO2 band."
    },
    {
      "id": "bare-rock-null",
      "label": "Bare-rock (no-atmosphere) null scenario",
      "sample_size_or_observations": "Model comparison scenario (airless planet assumption)",
      "description": "An atmosphere-free interpretation assuming a bare rocky surface with minimal heat redistribution, used as the null model against which atmosphere-bearing retrievals are compared."
    },
    {
      "id": "co2-rich-atmosphere",
      "label": "CO2-rich atmosphere scenario",
      "sample_size_or_observations": "Model retrieval family (CO2-rich composition)",
      "description": "Atmosphere-bearing retrievals with significant greenhouse gas absorption, motivated by spectral structure near 15 um and used to explore moderate-pressure CO2-rich solutions."
    },
    {
      "id": "o2-rich-atmosphere",
      "label": "O2-rich atmosphere scenario",
      "sample_size_or_observations": "Model retrieval family (oxidized composition)",
      "description": "An alternative atmosphere-bearing retrieval family exploring oxidized (O2-rich) compositions, noted as not fully ruled out with current data and with weaker CO2 signature constraints."
    }
  ],
  "major_limitations": [
    "Single-planet study; does not establish atmospheric prevalence across M-dwarf rocky planets.",
    "Retrieval assumptions (circulation, opacity priors, cloud treatment) affect quantitative posteriors.",
    "Stellar variability and instrument systematics can bias weak spectral features.",
    "Night-side constraints are weaker than day-side constraints in the current dataset."
  ]
}
