{
  "paper": {
    "title": "Phase-curve Evidence for an Atmosphere on TRAPPIST-1 b",
    "doi": "10.48550/arXiv.2409.13036",
    "publication_year": 2024,
    "domain": "exoplanet-atmospheres",
    "study_type": "observational-astronomy"
  },
  "core_question": "Whether the rocky planet TRAPPIST-1 b retains any atmosphere under strong stellar irradiation.",
  "datasets_or_cohorts": [
    {
      "id": "trappist-1b",
      "label": "Observed system",
      "sample_size_or_observations": "1 rocky exoplanet",
      "description": "TRAPPIST-1 b with phase-resolved thermal spectra."
    },
    {
      "id": "null-scenario",
      "label": "Null scenario",
      "sample_size_or_observations": "1 model",
      "description": "Bare-rock, no-atmosphere model with minimal heat redistribution."
    },
    {
      "id": "co2-scenario",
      "label": "CO2-rich atmosphere scenario",
      "sample_size_or_observations": "1 model",
      "description": "Atmosphere model with significant greenhouse gas absorption."
    },
    {
      "id": "o2-scenario",
      "label": "O2-rich atmosphere scenario",
      "sample_size_or_observations": "1 model",
      "description": "Oxidized composition with weaker CO2 signature constraints."
    }
  ],
  "major_limitations": [
    "Single-planet study does not establish atmospheric prevalence across all M-dwarf rocky planets.",
    "Retrieval assumptions such as circulation and cloud treatment affect quantitative posteriors.",
    "Stellar variability and instrument systematics can bias weak spectral features.",
    "Night-side constraints are weaker than day-side constraints in the current dataset."
  ]
}