{
  "paper": {
    "title": "Phase-curve Evidence for an Atmosphere on TRAPPIST-1 b",
    "doi": "10.48550/arXiv.2409.13036",
    "publication_year": 2024,
    "domain": "exoplanet-atmospheres",
    "study_type": "observational-astronomy"
  },
  "core_question": "The key question is whether it retains any atmosphere under strong stellar irradiation.",
  "datasets_or_cohorts": [
    {
      "id": "observed-system",
      "label": "Observed system",
      "sample_size_or_observations": "one rocky exoplanet (TRAPPIST-1 b)",
      "description": "Observed system: one rocky exoplanet (TRAPPIST-1 b) with phase-resolved thermal spectra."
    },
    {
      "id": "null-scenario",
      "label": "Null scenario",
      "sample_size_or_observations": "N/A",
      "description": "Null scenario: bare-rock, no-atmosphere model with minimal heat redistribution."
    },
    {
      "id": "co2-rich-atmosphere-scenario",
      "label": "CO2-rich atmosphere scenario",
      "sample_size_or_observations": "N/A",
      "description": "CO2-rich atmosphere scenario: atmosphere model with significant greenhouse gas absorption."
    }
  ],
  "major_limitations": [
    "This is a single-planet study and does not establish atmospheric prevalence across all M-dwarf rocky planets.",
    "Retrieval assumptions (circulation, opacity priors, cloud treatment) affect quantitative posteriors.",
    "Stellar variability and instrument systematics can bias weak spectral features.",
    "Night-side constraints are weaker than day-side constraints in the current dataset."
  ]
}