
{
    "paper": {
        "title": "Phase-curve Evidence for an Atmosphere on TRAPPIST-1 b",
        "doi": "10.48550/arXiv.2409.13036",
        "publication_year": 2024,
        "domain": "exoplanet-atmospheres",
        "study_type": "observational-astronomy"
    },
    "core_question": "Does the Earth-sized rocky planet TRAPPIST-1 b have an atmosphere, and what are its key properties?",
    "datasets_or_cohorts": [
        {
            "id": "observed-system",
            "label": "Observed System",
            "sample_size_or_observations": "One rocky exoplanet (TRAPPIST-1 b)",
            "description": "A single rocky exoplanet, TRAPPIST-1 b, with phase-resolved thermal spectra from JWST MIRI."
        },
        {
            "id": "null-scenario",
            "label": "Null Scenario",
            "sample_size_or_observations": "N/A",
            "description": "A bare-rock, no-atmosphere model with minimal heat redistribution, serving as a baseline for comparison."
        },
        {
            "id": "co2-rich-atmosphere",
            "label": "CO2-Rich Atmosphere Scenario",
            "sample_size_or_observations": "N/A",
            "description": "An atmosphere model with significant greenhouse gas absorption, specifically targeting CO2."
        },
        {
            "id": "o2-rich-atmosphere",
            "label": "O2-Rich Atmosphere Scenario",
            "sample_size_or_observations": "N/A",
            "description": "An alternative atmosphere model with an oxidized composition and weaker CO2 signature constraints."
        }
    ],
    "major_limitations": [
        "This is a single-planet study and does not establish atmospheric prevalence across all M-dwarf rocky planets.",
        "Retrieval assumptions (circulation, opacity priors, cloud treatment) affect quantitative posteriors.",
        "Stellar variability and instrument systematics can bias weak spectral features.",
        "Night-side constraints are weaker than day-side constraints in the current dataset."
    ]
}
