{
  "paper": {
    "title": "SARS-CoV-2 mRNA vaccines sensitize tumours to immune checkpoint blockade",
    "doi": "10.1038/s41586-025-09006-8",
    "publication_year": 2025,
    "domain": "oncology-immunology",
    "study_type": "preclinical+retrospective"
  },
  "core_question": "The paper investigates whether intratumoral delivery of an mRNA vaccine can create an interferon-rich inflammatory state that improves sensitivity to anti-PD-L1 therapy.",
  "datasets_or_cohorts": [
    {
      "id": "mouse-efficacy-combo",
      "label": "Mouse Efficacy (Combination)",
      "sample_size_or_observations": "78 mice",
      "description": "Tumor-bearing mice receiving the intratumoral mRNA vaccine and anti-PD-L1 combination therapy."
    },
    {
      "id": "human-retrospective",
      "label": "Human Retrospective Cohort",
      "sample_size_or_observations": "130 patients",
      "description": "Retrospective cohort of metastatic patients receiving ICI treatment, stratified by prior SARS-CoV-2 mRNA vaccination status."
    },
    {
      "id": "human-vaccinated-subgroup",
      "label": "Human Vaccinated Subgroup",
      "sample_size_or_observations": "43 patients",
      "description": "Subset of the human retrospective cohort that had received prior SARS-CoV-2 mRNA vaccination."
    },
    {
      "id": "mouse-control",
      "label": "Mouse Controls",
      "sample_size_or_observations": "84 mice",
      "description": "Tumor-bearing mice used as controls (vaccine only, ICI only, and vehicle) for efficacy experiments."
    }
  ],
  "major_limitations": [
    "The human analysis is retrospective and non-randomized; residual confounding is likely.",
    "Tumor-type mix and treatment-history heterogeneity limit direct causal interpretation.",
    "Mouse model effects may not map one-to-one to all human tumors.",
    "Vaccination timing relative to ICI initiation varied across patients."
  ]
}