{
  "paper": {
    "title": "Phase-curve Evidence for an Atmosphere on TRAPPIST-1 b",
    "doi": "10.48550/arXiv.2409.13036",
    "publication_year": 2024,
    "domain": "exoplanet-atmospheres",
    "study_type": "observational-astronomy"
  },
  "core_question": "The key question is whether TRAPPIST-1 b retains any atmosphere under strong stellar irradiation, using JWST MIRI phase-curve spectroscopy to constrain day-night heat transport and atmospheric composition.",
  "datasets_or_cohorts": [
    {
      "id": "observed-system",
      "label": "TRAPPIST-1 b observations",
      "sample_size_or_observations": "One rocky exoplanet with phase-resolved thermal spectra",
      "description": "JWST MIRI low-resolution spectroscopy observations of TRAPPIST-1 b over an orbital phase curve, capturing thermal phase variation and spectral structure around the 15 um CO2 band."
    },
    {
      "id": "null-scenario",
      "label": "Bare-rock null model",
      "sample_size_or_observations": "No-atmosphere model with minimal heat redistribution",
      "description": "Null scenario representing a bare-rock, no-atmosphere model with minimal heat redistribution, used as a baseline comparison for atmosphere-bearing scenarios."
    },
    {
      "id": "co2-atmosphere",
      "label": "CO2-rich atmosphere model",
      "sample_size_or_observations": "Atmosphere model with significant greenhouse gas absorption",
      "description": "Atmosphere-bearing scenario with CO2-rich composition, featuring significant greenhouse gas absorption and moderate-pressure (0.3-1.0 bar) solutions favored by retrievals."
    },
    {
      "id": "o2-atmosphere",
      "label": "O2-rich atmosphere model",
      "sample_size_or_observations": "Oxidized composition with weaker CO2 signature constraints",
      "description": "Atmosphere scenario with oxidized composition (O2-rich), which remains plausible as current data do not fully rule out this interpretation."
    }
  ],
  "major_limitations": [
    "This is a single-planet study and does not establish atmospheric prevalence across all M-dwarf rocky planets.",
    "Retrieval assumptions (circulation, opacity priors, cloud treatment) affect quantitative posteriors.",
    "Stellar variability and instrument systematics can bias weak spectral features.",
    "Night-side constraints are weaker than day-side constraints in the current dataset."
  ]
}